product_id,product_name,price,description,category
1,Official,439.3,Rich cover interest other.,Home & Garden
2,Development,239.26,Note case state charge join dog.,Toys
3,Four,46.18,Senior give item cultural four.,Electronics
4,Energy,378.62,The free still method huge.,Books
5,Deal,373.18,Score ask difficult.,Toys
6,West,798.95,Give sister year region.,Clothing
7,Explain,129.24,Program million mind.,Clothing
8,They,732.71,Law bad traditional strategy little quickly.,Books
9,Serve,302.92,Spring him either teacher.,Home & Garden
10,Also,758.11,World include work church maintain maybe.,Clothing
11,Capital,202.29,Shake he just member no fund need my.,Home & Garden
12,City,486.57,Administration power newspaper.,Clothing
13,Chance,571.69,Beautiful professional toward student treatment group.,Toys
14,Stand,918.13,Account then positive pull.,Electronics
15,Establish,571.89,Summer art campaign notice though either run.,Toys
16,Imagine,929.37,Site view young like.,Electronics
17,Though,214.74,Unit least such enter pretty interview hand value.,Clothing
18,White,957.51,Member prevent reason.,Clothing
19,Design,681.27,Which pass special after tend.,Toys
20,Federal,418.04,Behavior administration control clearly.,Home & Garden
21,Soon,730.02,Most nor it order fear increase.,Electronics
22,West,934.47,Face design husband to smile explain prove.,Home & Garden
23,Town,70.68,Thousand could against also.,Electronics
24,Policy,671.06,Ok but myself tend major continue attack.,Clothing
25,Week,103.59,Meet serious letter arm blue catch.,Toys
26,Argue,183.23,Focus give life force.,Home & Garden
27,Region,76.13,Her which bag line if especially.,Books
28,Weight,520.91,Hot view true medical leave machine.,Home & Garden
29,New,436.24,Identify direction plan understand.,Clothing
30,Somebody,959.26,Conference draw great likely alone should moment program.,Home & Garden
31,Old,509.81,Pull represent senior herself live.,Home & Garden
32,Policy,365.58,Model strategy really turn wait range age what.,Electronics
33,Material,988.31,Especially receive general on economic statement several.,Electronics
34,Indeed,286.81,Agent couple officer protect return fill current base.,Toys
35,Officer,220.5,Relate idea election drop such kind.,Toys
36,Girl,203.46,Shake onto sense answer usually one out.,Electronics
37,If,788.71,Its production right north exist that.,Electronics
38,Shake,988.02,People school human dinner.,Toys
39,These,778.92,Information everything cover score a.,Toys
40,Even,282.91,Than drug standard debate personal enter.,Electronics
41,Seek,706.02,Vote perform too past.,Clothing
42,Environmental,381.52,Share art day growth bag road trial.,Electronics
43,Language,897.03,Summer teach military PM down mouth.,Clothing
44,Debate,636.11,Total discover energy foot fund today.,Electronics
45,Region,388.9,Manager your them people level as.,Home & Garden
46,Power,165.0,Participant trial catch.,Books
47,Main,766.12,Game parent form day.,Electronics
48,Television,573.79,Himself program than ever stay compare again.,Toys
49,Inside,360.67,Test reality probably remember whatever usually.,Electronics
50,Season,898.09,Glass still response baby wear series.,Clothing
51,He,687.4,Worry pick when activity station.,Electronics
52,Picture,60.52,Option century east.,Electronics
53,Always,932.37,Economic health picture purpose trip nature.,Clothing
54,Job,452.12,Level event traditional benefit major approach.,Home & Garden
55,Vote,890.05,Second attorney class process condition.,Books
56,Business,291.02,Tree participant through five.,Clothing
57,Business,21.06,Carry strategy short trouble near.,Toys
58,Push,579.06,Environment water present door my.,Home & Garden
59,Scene,57.13,Economic skin everything response however.,Clothing
60,A,255.69,Role sea meeting claim.,Books
61,Popular,746.57,Prove student technology reflect thing partner.,Electronics
62,Stuff,56.5,Room per officer draw next fear to.,Electronics
63,According,979.51,Only defense political also product catch myself.,Toys
64,Include,344.67,Main picture Republican available system.,Clothing
65,Establish,647.74,Expert certain able.,Books
66,Strong,262.3,Apply half already especially experience live.,Books
67,Loss,131.6,Sense move up break college garden.,Clothing
68,Necessary,457.09,Try Democrat through employee hour check.,Home & Garden
69,Information,147.46,Entire soldier street once.,Toys
70,Option,857.87,Knowledge tend power building.,Electronics
71,Science,52.38,Significant growth case ok fact life point.,Electronics
72,Or,15.34,Who machine Mr director.,Electronics
73,Democrat,566.11,Down question what guess pass.,Electronics
74,Top,517.06,Blood seek it suffer.,Home & Garden
75,Class,104.55,Mention join forget range section.,Home & Garden
76,Political,769.64,Party you even talk lose subject side.,Clothing
77,Local,460.69,There list must protect American issue.,Home & Garden
78,Stand,391.54,This apply well bar.,Home & Garden
79,Success,954.99,Against citizen say heart to also positive.,Books
80,Clear,284.34,Third compare pressure that not show.,Books
81,Form,707.24,Break training level industry because trouble.,Electronics
82,Current,757.06,Guess watch bank memory less plant traditional.,Electronics
83,Play,131.72,Edge study special hotel dinner fact visit.,Books
84,Possible,731.57,Receive political imagine report she myself.,Toys
85,Leg,72.93,Moment nice create let each star would.,Toys
86,Agency,22.34,Company run near growth.,Toys
87,Down,668.98,Manage night side past into interesting last.,Electronics
88,Ask,674.17,East no remain physical.,Electronics
89,Detail,989.86,Participant find blood according wrong city.,Home & Garden
90,Product,573.78,Wind fill task food.,Books
91,Life,154.07,Large food prove wonder various.,Books
92,Politics,420.83,Government student establish.,Toys
93,Couple,298.66,Dinner suffer American claim indeed.,Home & Garden
94,Throw,265.02,Firm thing vote southern.,Toys
95,Meeting,453.28,North moment before ability game.,Clothing
96,Yet,752.99,Recognize lot adult if.,Electronics
97,Join,671.38,Natural south under physical high third century.,Books
98,Machine,494.84,With the culture benefit actually program degree.,Books
99,Focus,107.52,Full fear only tough but situation.,Clothing
100,During,25.87,Impact sing Mr.,Clothing
